{"$schema":"https://json-schema.org/draft/2020-12/schema","$id":"agent-result.schema.json","type":"object","additionalProperties":false,"required":["protocol_version","run_id","attempt_id","task_id","status","artifacts"],"properties":{"protocol_version":{"const":"1.0"},"run_id":{"type":"string","minLength":1},"attempt_id":{"type":"string","minLength":1},"task_id":{"type":"string","minLength":1},"status":{"enum":["completed","failed","budget_exceeded"]},"output":{"type":"object"},"artifacts":{"type":"array","items":{"type":"object","additionalProperties":false,"required":["path","type","description"],"properties":{"path":{"type":"string","minLength":1},"type":{"type":"string","minLength":1},"description":{"type":"string"}}}},"usage":{"type":"object","additionalProperties":false,"properties":{"model_calls":{"type":"integer","minimum":0},"input_tokens":{"type":"integer","minimum":0},"output_tokens":{"type":"integer","minimum":0},"tool_calls":{"type":"integer","minimum":0}}},"error":{"type":"object","additionalProperties":false,"required":["code","message"],"properties":{"code":{"type":"string"},"message":{"type":"string"},"details":{"type":"object"}}},"extensions":{"type":"object"}},"allOf":[{"if":{"properties":{"status":{"const":"completed"}}},"then":{"required":["output"]}},{"if":{"properties":{"status":{"enum":["failed","budget_exceeded"]}}},"then":{"required":["error"]}}]}
