{
  "protocol_version": "1.0",
  "run_id": "run-example",
  "attempt_id": "attempt-0001",
  "task_id": "arithmetic",
  "status": "completed",
  "output": {"selected_choice": "B"},
  "artifacts": [
    {"path": "decision.txt", "type": "text/plain", "description": "Decision trace"}
  ],
  "extensions": {"fixture": true}
}
